{
  "workload": "Dhrystone",
  "threads": 14,
  "samples": 5,
  "iterations_per_sample": 10000000,
  "values": [
    2305.7371401833225,
    2317.291223161661,
    2275.8786706465726,
    2299.606704851343,
    2292.7691012314663
  ],
  "average": 2298.256568014873,
  "min": 2275.8786706465726,
  "max": 2317.291223161661
}